{"$schema":"https://json-schema.org/draft/2020-12/schema","$id":"urn:bildr:harness.supervisor-decision.v1","title":"BILDR supervisor decision v1","type":"object","additionalProperties":false,"required":["schema","decision_id","snapshot_id","run_id","snapshot_revision","created_at","requested_model","effective_model","requested_effort","effective_effort","summary","goal_assessment","task_assessments","agent_assessments","actions","confidence","uncertainties","next_review"],"properties":{"schema":{"const":"harness.supervisor-decision.v1"},"decision_id":{"type":"string","minLength":1,"maxLength":128,"pattern":"^[A-Za-z0-9._:-]+$"},"snapshot_id":{"type":"string","minLength":1,"maxLength":128,"pattern":"^[A-Za-z0-9._:-]+$"},"run_id":{"type":"string","minLength":1,"maxLength":128,"pattern":"^[A-Za-z0-9._:-]+$"},"snapshot_revision":{"type":"integer","minimum":1},"created_at":{"type":"string","format":"date-time"},"requested_model":{"type":"string","minLength":1,"maxLength":128},"effective_model":{"type":"string","minLength":1,"maxLength":128},"requested_effort":{"type":"string","enum":["high","xhigh"]},"effective_effort":{"type":"string","enum":["high","xhigh"]},"summary":{"type":"string","minLength":1,"maxLength":3000},"goal_assessment":{"$ref":"#/$defs/goalAssessment"},"task_assessments":{"type":"array","maxItems":100,"items":{"$ref":"#/$defs/taskAssessment"}},"agent_assessments":{"type":"array","maxItems":100,"items":{"$ref":"#/$defs/agentAssessment"}},"actions":{"type":"array","minItems":1,"maxItems":50,"items":{"$ref":"#/$defs/action"}},"confidence":{"type":"object","additionalProperties":false,"required":["overall","goal_assessment","action_plan","reason_codes"],"properties":{"overall":{"type":"string","enum":["low","medium","high"]},"goal_assessment":{"type":"string","enum":["low","medium","high"]},"action_plan":{"type":"string","enum":["low","medium","high"]},"reason_codes":{"type":"array","maxItems":20,"uniqueItems":true,"items":{"type":"string","minLength":1,"maxLength":128}}}},"uncertainties":{"type":"array","maxItems":20,"items":{"type":"string","minLength":1,"maxLength":1000}},"next_review":{"type":"object","additionalProperties":false,"required":["mode","at","reason"],"properties":{"mode":{"type":"string","enum":["on_event","at_time","none"]},"at":{"type":["string","null"],"format":"date-time"},"reason":{"type":"string","minLength":1,"maxLength":1000}}}},"$defs":{"evidenceRef":{"type":"object","additionalProperties":false,"required":["kind","id","summary"],"properties":{"kind":{"type":"string","enum":["command","validation","artifact","finding","diff","commit","context","goal","agent_message","expert_response","event"]},"id":{"type":"string","minLength":1,"maxLength":128,"pattern":"^[A-Za-z0-9._:-]+$"},"digest":{"anyOf":[{"type":"string","pattern":"^[0-9a-f]{64}$"},{"type":"null"}]},"summary":{"type":"string","minLength":1,"maxLength":1000}}},"actionKind":{"type":"string","enum":["wait","continue_attempt","steer_active_turn","start_followup_turn","retry_fresh_attempt","spawn_explorer","spawn_reviewer","reroute_attempt","request_expert","request_replan","request_verification","queue_integration","cancel_attempt","pause_for_human","stop_run"]},"goalAssessment":{"type":"object","additionalProperties":false,"required":["status","progress_class","drift_detected","rationale","critical_path_summary","criteria_proven_ids","criteria_missing_ids","evidence_refs"],"properties":{"status":{"type":"string","enum":["aligned","on_track","at_risk","blocked","needs_replan","completion_candidate"]},"progress_class":{"type":"string","enum":["no_progress","early","advancing","near_complete","completion_candidate"]},"drift_detected":{"type":"boolean"},"rationale":{"type":"string","minLength":1,"maxLength":3000},"critical_path_summary":{"type":"string","minLength":1,"maxLength":2000},"criteria_proven_ids":{"type":"array","maxItems":100,"uniqueItems":true,"items":{"type":"string","minLength":1,"maxLength":128,"pattern":"^[A-Za-z0-9._:-]+$"}},"criteria_missing_ids":{"type":"array","maxItems":100,"uniqueItems":true,"items":{"type":"string","minLength":1,"maxLength":128,"pattern":"^[A-Za-z0-9._:-]+$"}},"evidence_refs":{"type":"array","maxItems":50,"items":{"$ref":"#/$defs/evidenceRef"}}}},"taskAssessment":{"type":"object","additionalProperties":false,"required":["task_id","progress_class","efficiency_class","summary","issue_codes","recommended_action_ids"],"properties":{"task_id":{"type":"string","minLength":1,"maxLength":128,"pattern":"^[A-Za-z0-9._:-]+$"},"progress_class":{"type":"string","enum":["no_progress","early","advancing","near_complete","completion_candidate","blocked"]},"efficiency_class":{"type":"string","enum":["unknown","healthy","watch","degraded","stalled"]},"summary":{"type":"string","minLength":1,"maxLength":2000},"issue_codes":{"type":"array","maxItems":20,"uniqueItems":true,"items":{"type":"string","minLength":1,"maxLength":128}},"recommended_action_ids":{"type":"array","maxItems":20,"uniqueItems":true,"items":{"type":"string","minLength":1,"maxLength":128,"pattern":"^[A-Za-z0-9._:-]+$"}}}},"agentAssessment":{"type":"object","additionalProperties":false,"required":["session_id","efficiency_class","strategy","summary","reason_codes","recommended_action_ids"],"properties":{"session_id":{"type":"string","minLength":1,"maxLength":128,"pattern":"^[A-Za-z0-9._:-]+$"},"efficiency_class":{"type":"string","enum":["unknown","healthy","watch","degraded","stalled"]},"strategy":{"type":"string","enum":["continue","steer","follow_up","retry_fresh","reroute","review","wait","cancel"]},"summary":{"type":"string","minLength":1,"maxLength":2000},"reason_codes":{"type":"array","maxItems":20,"uniqueItems":true,"items":{"type":"string","minLength":1,"maxLength":128}},"recommended_action_ids":{"type":"array","maxItems":20,"uniqueItems":true,"items":{"type":"string","minLength":1,"maxLength":128,"pattern":"^[A-Za-z0-9._:-]+$"}}}},"action":{"type":"object","additionalProperties":false,"required":["action_id","kind","target","priority","impact","reason_code","summary","prompt","model_route","expected_observable_outcome","preconditions","evidence_refs","dedupe_key","expires_at","expert_brief"],"properties":{"action_id":{"type":"string","minLength":1,"maxLength":128,"pattern":"^[A-Za-z0-9._:-]+$"},"kind":{"$ref":"#/$defs/actionKind"},"target":{"type":"object","additionalProperties":false,"required":["kind","id","task_id","attempt_id","session_id"],"properties":{"kind":{"type":"string","enum":["run","task","attempt","session"]},"id":{"type":"string","minLength":1,"maxLength":128,"pattern":"^[A-Za-z0-9._:-]+$"},"task_id":{"anyOf":[{"type":"string","minLength":1,"maxLength":128,"pattern":"^[A-Za-z0-9._:-]+$"},{"type":"null"}]},"attempt_id":{"anyOf":[{"type":"string","minLength":1,"maxLength":128,"pattern":"^[A-Za-z0-9._:-]+$"},{"type":"null"}]},"session_id":{"anyOf":[{"type":"string","minLength":1,"maxLength":128,"pattern":"^[A-Za-z0-9._:-]+$"},{"type":"null"}]}}},"priority":{"type":"string","enum":["immediate","next","when_ready"]},"impact":{"type":"string","enum":["low","medium","high","critical"]},"reason_code":{"type":"string","minLength":1,"maxLength":128},"summary":{"type":"string","minLength":1,"maxLength":2000},"prompt":{"type":["string","null"],"maxLength":12000},"model_route":{"type":"null","description":"Advisory supervision has a controller-fixed Terra route; the model cannot request or override a route."},"expected_observable_outcome":{"type":"string","minLength":1,"maxLength":2000},"preconditions":{"type":"array","maxItems":30,"items":{"type":"string","minLength":1,"maxLength":1000}},"evidence_refs":{"type":"array","maxItems":50,"items":{"$ref":"#/$defs/evidenceRef"}},"dedupe_key":{"type":"string","minLength":1,"maxLength":256},"expires_at":{"type":"string","format":"date-time"},"expert_brief":{"anyOf":[{"$ref":"#/$defs/expertBrief"},{"type":"null"}]}}},"expertBrief":{"type":"object","additionalProperties":false,"required":["category","impact","question","why_normal_agents_cannot_resolve","known_facts","disputed_claims","constraints","required_output","task_ids","evidence_refs"],"properties":{"category":{"type":"string","enum":["architecture_invariant","canonical_contract","security_authorization","tenancy_privacy","data_integrity","unsafe_native_or_hardware","integration_conflict","repeated_failure","qualified_agent_disagreement","other_high_impact"]},"impact":{"type":"string","enum":["high","critical"]},"question":{"type":"string","minLength":1,"maxLength":4000},"why_normal_agents_cannot_resolve":{"type":"string","minLength":1,"maxLength":3000},"known_facts":{"type":"array","minItems":1,"maxItems":50,"items":{"type":"string","minLength":1,"maxLength":2000}},"disputed_claims":{"type":"array","maxItems":50,"items":{"type":"string","minLength":1,"maxLength":2000}},"constraints":{"type":"array","maxItems":50,"items":{"type":"string","minLength":1,"maxLength":2000}},"required_output":{"type":"array","minItems":1,"maxItems":20,"items":{"type":"string","minLength":1,"maxLength":1000}},"task_ids":{"type":"array","minItems":1,"maxItems":20,"uniqueItems":true,"items":{"type":"string","minLength":1,"maxLength":128,"pattern":"^[A-Za-z0-9._:-]+$"}},"evidence_refs":{"type":"array","minItems":1,"maxItems":100,"items":{"$ref":"#/$defs/evidenceRef"}}}}}}
